{
  "operation": "forecast",
  "birth": {
    "utc": {
      "year": 2000,
      "month": 1,
      "day": 1,
      "hour": 12,
      "minute": 0
    },
    "location": {
      "latitude": 10.8231,
      "longitude": 106.6297
    },
    "houseSystem": "placidus"
  },
  "period": {
    "kind": "year",
    "year": 2026,
    "utcOffsetMinutes": 420
  },
  "bodies": [
    "jupiter",
    "saturn",
    "uranus",
    "neptune",
    "pluto"
  ]
}
